{
  "$comment": "GENERADO por packages/ui/scripts/design-json.mjs desde packages/ui/codice-tokens.json v1.3.0 (órdenes Códice #35 y #37), en el esquema v1 del molde. No se edita a mano: tokens.test.mjs lo regenera y lo compara byte a byte. De dónde sale cada valor: MAPA_MOLDE en ese script.",
  "app": {
    "nombre": "Armando Duarte",
    "frase": {
      "es": "Entra a tu *espacio*.",
      "en": "Enter your *space*.",
      "pt": "Entre no seu *espaço*."
    },
    "espanol": "neutro"
  },
  "color": {
    "fondo": "#FAF7F1",
    "papel": "#F3EBDD",
    "texto": "#2E2B25",
    "texto2": "#716A60",
    "linea": "#EAE4D8",
    "acento": "#005761",
    "error": "#A05A48",
    "ok": "#6E8F6A",
    "aviso": "#B08A52"
  },
  "colorOscuro": {
    "fondo": "#16181C",
    "papel": "#212327",
    "texto": "#FAF7F1",
    "texto2": "#B6B4B1",
    "linea": "#3A3C3E",
    "acento": "#3D9CA4",
    "error": "#B47D6D",
    "ok": "#74936F",
    "aviso": "#B08A52"
  },
  "tipografia": {
    "sans": "Montserrat",
    "serif": "Montserrat",
    "mono": "system"
  },
  "radio": {
    "boton": 2,
    "campo": 2,
    "tarjeta": 12
  }
}
